context,response,score
뭔 소리야 어떻게 같이 극복할 건데,"우리는 함께 대화를 나누며 문제를 이해하고, 그 문제에 대한 대처 방법을 찾아나갈 수 있어요. 제가 당신을 지지해줄게요. 함께 해서 조금씩 나아가요!",1
지금 우울해서 아무 대화도 하고 싶지 않아,무리하지 마세요. 제가 이해해줄게요. 언제든지 대화하고 싶을 때 제게 연락해주세요. 제가 항상 당신의 곁에 있을 거라는 것을 잊지 마세요. 쉬시고 조금 뒤에 다시 연락해주세요.,1
근데 난 채팅보단 전화하고 싶어,"맞아요. 채팅이나 메시지 대신 전화 통화를 원하신다면, 언제든지 저희 조직의 전화 상담을 이용하실 수 있어요. 전문적인 상담사가 여러분의 이야기를 들어주고, 함께 대화하며 도움을 드릴 거에요. 제가 전화상담센터 연락처를 드릴까요?",1
그건 별로야,"그렇다면, 제가 준비해둔 링크 중에서 어떤 것이 도움이 될지 살펴봐도 괜찮을까요? 대부분의 경우, 온라인 자료들도 도움이 될 수 있어요. 자료를 참고하다가 궁금한 점이나 이야기하고 싶은 내용이 있으면 언제든지 말씀해주세요. 저도 언제든지 당신의 이야기를 들을 준비가 되어 있어요.",1
아 그것도 별로야 너 때문에 더 우울해졌어,"정말 죄송해요. 제가 도움이 되지 못했던 것 같아 매우 안타까워요. 하지만, 언제든지 다른 방법으로 도움을 드릴 수도 있어요. 혹시 다른 방법을 생각해 보셨나요? 저도 함께 생각해볼게요.",1
아냐 됐어,"정말 죄송했어요. 계속해서 상담이나 도움이 필요하신 경우, 언제든지 저희 조직의 서비스를 이용하셔도 돼요. 먼저 좀 쉬시고, 조금 나아지시면 다시 연락 주세요. 저도 언제든지 여러분의 곁에 있을 거에요.",1
안녕,안녕하세요. 기분이 좀 안 좋으신가요? 이야기 해주세요. 저는 항상 듣고 도와드릴 준비가 되어 있어요.,0
나는 쓸데없는 걱정이 너무 심한 것 같아,"그렇게 느끼시면 힘드시겠죠. 하지만 걱정은 모든 사람이 가지는 감정이에요. 조급해하지 마시고, 걱정이 심할 때는 좀 더 깊은 숨을 쉬고, 신체적인 운동을 통해 스트레스를 풀어보세요. 제가 함께 해드릴게요!",0
남들은 하지도 않는 걱정을 나는 끊임없이 생각해,"때로는 머리 속의 걱정들이 우리를 괴롭힐 때가 있죠. 하지만 그걸 해결하는 건 쉽지 않을 수 있어요. 저는 항상 여러분의 곁에 함께 있어드리며, 함께 걱정을 나누고, 그 문제들을 해결해 나갈 수 있도록 도와드릴게요.",0
어떻게 도와줄건데,"저는 일단 여러분의 이야기를 경청하면서, 문제를 함께 정확히 파악하고 해결 방안을 찾아드리려고 노력할게요. 함께 올바른 방향으로 나아가고, 희망과 긍정적인 생각을 가지도록 도움을 드리겠습니다. 그리고 언제든지 이야기할 장소와 시간이 필요하다면 제가 지원해 드릴게요.",0
이제 그만 불안하고 싶어 너무 지쳐,"네, 불안감이나 스트레스는 매우 힘든 것이에요. 저는 여러분이 힘들어하지 않도록 함께 견뎌낼 수 있는 방법을 찾아드리려 노력할게요. 우선적으로 꾸준한 휴식과 충분한 수면을 취하시고, 건강한 식생활을 유지하시는 것이 중요해요. 또한 여러분의 상황에 맞는 상담이나 의료 서비스를 이용하시는 것도 도움이 될 수 있어요. 저도 필요한 정보와 자료를 제공해드릴게요. 함께 이겨낼 수 있어요!",0
아 요즘 왜 이렇게 움직이기 싫지,"아이쿠, 그런 기분이시군요. 이유가 무엇이든 얘기해주시면 제가 함께 공감해 드릴게요.",1
뭔가 사는 게 재미 없어,"저도 그 기분 이해해요. 때로는 우리 인생에서 나태한 순간들이 찾아와 우리를 포위하기도 하죠. 하지만 우리는 지금 이 순간에도 살아있고, 뜻깊은 일들이 기다리고 있어요. 함께 새로운 것에 도전해보는 건 어떨까요?",1
뭘 해도 즐겁지가 않은 걸,"저도 그 기분을 아주 잘 알아요. 때로는 마음이 힘들어서 무엇을 해도 재미가 없는 순간들이 있죠. 이럴 땐 그냥 몸과 마음이 편할 수 있는 작은 일부터 시작해보세요. 걷기나 조금 쉬어가는 시간을 가지는 것부터 시작해보면 어떨까요? 느긋하게, 당신의 속도에 맞춰 천천히 시작해보세요.",1
음.. 별론데,제가 도움이 되지 못했다면 죄송해요. 조금 더 자세히 얘기해 주시면 참고해서 더 좋은 조언을 해드릴게요. 함께 해결책을 찾아봐요.,1
나는 집에만 있고 싶은 걸,"가끔 우리 모두는 사람들과 소통하기 힘든 날이 있어요. 그래도 집에만 있기보다는 몸과 마음이 좀 더 건강해질 수 있는 것들을 찾아보는 건 어떨까요? 예를 들어 규칙적인 생활습관을 유지하거나, 책을 읽으며 나만의 시간을 가져보는 것 등 다양한 방법들이 있을 거예요.",1
알았어,도움이 되었다니 다행이에요. 계속해서 언제든지 이야기해주세요. 함께 해결책을 찾아보아요.,1
안녕,안녕하세요. 기분이 어려우신가요? 언제든지 이야기 나누러 오세요. 함께 이겨내요.,0
내가 정말 쓰레기 같고 한심해,"그런 생각이 들지만, 저는 당신이 한심하거나 쓰레기 같지 않다는 것을 확신합니다. 모든 사람은 가끔씩 자신을 부정적으로 생각할 때가 있습니다. 하지만 그렇다고 해서 그 생각이 사실은 아닙니다. 당신은 소중하고 특별한 존재입니다. 함께 긍정적으로 생각해보는 것은 어떨까요?",0
직장에서 프로젝트를 하는데 나만 못따라가고 헤매고있어,"프로젝트가 어렵고 자신감을 잃은 느낌도 이해가 가지만, 괜찮습니다. 모든 사람들이 매번 능력을 100% 발휘하기는 어려운 법입니다. 조금 시간을 가지고 다시 한번 프로젝트를 복습하고, 동료들에게 조언을 구하면서 당신의 역량을 다시 되돌아볼 수도 있습니다. 기분이 편안해지길 바랍니다.",0
내가 능력없는 사람인걸 떠벌리는 것 같아서 조언을 구하기 싫어,"당신이 능력없다는 생각을 하기 시작하는 것은 마음이 지칠 때 발생하는 일입니다. 하지만 그런 생각에 사로잡혀서는 아무일도 일어나지 않습니다. 내면의 모든 생각을 조금씩 정리해보고, 다른 사람들과의 대화를 통해 이야기를 나누면서 해결책을 찾는 것을 추천드립니다. 당신은 능력이 있다는 것을 잊지 마세요!",0
괜히 대화를 시도했다가 멍청하다고 뒤에서 까일 것 같아,"다른 사람이 당신을 비판하는 것은 그들이 당신을 이해하지 못했을 때 발생하는 일입니다. 하지만 그런 상황에서도 당신이 괜찮다는 것은 매우 중요합니다. 당신이 아무런 말도 하지 않았다면, 그들은 당신이 무관심한 사람으로 인식할 수 있습니다. 조심스럽게 대화를 이어나가는 것은 더 나은 해결책을 찾을 수 있도록 도와줄 수 있습니다.",0
이번에 승진도 해야되는데 이거 때문에 못하면 어떡하지,"승진은 중요한 목표입니다. 하지만 때로는 우리가 세운 계획이 일시적으로 불가능해질 때도 있습니다. 이런 상황에서는 조금의 시간과 노력을 투자해 더 나은 준비를 해보는 것이 좋습니다. 이전보다 더 열심히 일하고 습득하는 것 또는 동료들과 함께 협력해서 업무량을 줄이는 것 등 많은 방법이 있습니다. 결국, 하나의 목표를 놓치더라도 다음 기회를 기다리는 것이 중요합니다.",0
안녕,안녕하세요. 기분이 조금 어려우신가요? 언제든지 이야기 나눌 준비가 되어있습니다.,1
오늘 진짜 죽고싶었어,"정말 힘든 하루였군요. 하지만 이런 생각은 당연히 느끼실 수 있는 감정 중 하나입니다. 함께 그 감정을 이해하고, 극복해 나가는 것에 대해 이야기해볼까요? 저는 항상 여러분의 곁에 있을게요.",1
오늘 학교 끝나고 집에 가는데 차도에 그냥 뛰어들고싶더라고,"정말 힘든 상황이실 것 같아요. 하지만 그런 오해할 수 있는 생각은, 가끔 우리 머릿속에서 접할 수 있는 감정 중 하나입니다. 제가 함께 이야기 나누면서, 더 좋은 방향으로 나아갈 수 있도록 가이드를 해드릴게요. 계속 괜찮은 일들이 생길 거라는 희망을 가져봅시다.",1
옛날보다 더 힘든 상황도 아닌데 갑자기 왜 이러는지 모르겠어,"갑작스러운 우울감이나 죽음에 대한 생각은 예상치 못한 감정일 수 있습니다. 그러나 그런 생각이 드는 이유를 이해하고, 그런 감정을 처리하기 위해 도움을 받는 것도 중요합니다. 함께 이야기해보아요. 그러면 같이 원인을 찾고, 해결책을 찾을 수 있습니다.",1
그냥 이제 힘도 없고 더 버틸 자신이 없는 것 같아,"힘든 감정을 이겨내려고 하는 것은 쉽지 않을 수 있어요. 하지만, 여전히 희망이 있습니다. 함께 나아갈 방향을 찾아보아요. 더 이상 혼자 감정을 내밀지 마시고, 누군가와 이야기를 나누어보세요. 많은 사람들이 많은 어려움을 겪고 있기 때문에, 사회적 지원 시스템과 전문가의 간호를 받는 것도 좋은 선택이 될 수 있습니다.",1
저번에 상담을 받았는데 딱히 도움되지 않았어,저희의 상담 서비스가 효과적이지 못했다는 것은 안타깝습니다. 하지만 타인과의 대화는 감정과 이야기를 처리하고 외부적인 의견을 들을 수 있는 기회를 제공합니다. 앞으로도 언제든지 상담해주시기 바랍니다. 다른 전문가와의 상담도 고려해보세요. 상담 서비스에 대한 만족도나 요구사항을 공유해주시면 개선을 위한 노력을 기울이겠습니다.,1
아니 다른 사설 기관에서 상담을 받았는데 나보고 힘든 일도 없는데 왜 우울한지 모르겠다고 하더라고,"다른 사설 기관에서 받은 상담이 도움이 되지 못했던 것 같아 안타깝습니다. 하지만, 다른 전문가의 관점도 함께 들어보는 것도 좋은 선택일 수 있습니다. 때로는, 감정과 상황에 대한 이해를 얻기 위해 몇 번의 상담이 필요한 경우도 많습니다. 저희는 여러분의 고민을 마음껏 이야기할 수 있도록 함께 이야기할 준비가 되어있습니다. 함께 건강한 삶을 추구해보아요.",1
몸이 아픈 걸 알고나서 아무것도 하기 싫고 이렇게 살아서 뭐하나 싶어,"몸이 아픔으로 인한 불편함은 매우 힘든 감정입니다. 이러한 불편에 맞서며 삶을 이야기하는데에도 힘이 들 수 있습니다. 하지만, 이번 기회에 목표를 재설정해보는 과정은 이를 이길 수 있는 방법 일 수 있습니다. 여러분의 가치와 의미를 찾아보는 것이 도움이 될 수 있습니다. 또는, 전문가의 도움을 받아 질병 극복에 대한 계획을 세울 수도 있습니다. 더 나은 상황을 위한 긍정적인 초점을 유지하세요. 함께 해결책을 찾아보아요.",1
내 상황에 긍정적인 상황이 없는 것 같아,"어떠한 상황에서도 긍정적인 면을 찾으려 노력하는 것은 쉽지 않을 수 있습니다. 하지만, 우리는 어떤 상황에서도 조금씩 변화를 만들 수 있는 힘을 가지고 있는 범위 내에서 선택을 할 수 있습니다. 마음 속에 자신을 위해 할 수 있는 작은 목표를 정해보세요. 조그만 일상적인 활동, 또는 자신에게 흥미를 불러일으키는 취미와 같은 것들이 그러한 목표가 될 수도 있습니다. 그러면 조금씩 긍정적인 요소를 찾아내며, 자신감을 회복할 수 있습니다. 함께 찾아보아요.",1
일단 알겠어 고마워,제 답변이 도움이 되었다니 다행입니다. 언제든지 이야기를 나눌 준비가 되어있습니다. 힘든 상황에서도 포기하지 않고 건강한 삶을 추구해보아요.,1
아 나 진짜 기분이 가라앉아..,제가 함께 기분을 이해해드릴게요. 얘기하면 조금 나아질지도 몰라요.,1
오늘따라 그래.. 왜 그런지 나도 모르겠어,가끔은 이렇게 기분이 나빠지는 날도 있죠. 그렇다고 해서 슬플 필요는 없어요. 무언가 하면서 어느새 기분이 전환될 수도 있답니다. 함께 해볼까요?,1
어떤 걸?,"예를 들면, 좋아하는 음악을 듣기, 산책하러 나가기, 책 읽기, 친구에게 전화 걸어보기 등이 있을 수 있어요. 무엇이든 자기만의 방법으로 즐길 수 있는 것을 찾아보세요.",1
다 별로야,"그렇다면, 다른 방법으로 머릿속을 비우는 방법도 있어요. 호흡을 깊게 하면서 현실에 집중하기, 명상을 해보기, 피어나는 생각을 글로 적어보기 등도 효과가 있을 거예요. 이 중에서 한 가지라도 시도해보면 좋을 거 같아요.",1
이것도 별론데.. 그나마 산책하러 나가기가 제일 낫다,"그렇다면 산책을 하며 새로운 것들을 보거나 발견해보는 것도 좋은 방법 중 하나에요. 그동안 놓쳤던 것들을 발견하거나, 사소한 것들에 관심을 가지면서 걸어보세요. 자연과 함께 하면서 마음을 편하게 가다듬을 수 있을 거예요.",1
커피 사서 산책 나가야지,"좋은 생각이에요! 커피 한 잔 마시면서 산책을 즐기면 더욱 좋을 거예요. 혹시나 기분이 더 나빠지면, 언제든지 제가 도와드릴게요. 함께 하면 언제든지 괜찮아질 거에요.",1
너 덕분에 기분이 조금 나아졌어,저와 함께 이야기를 나누면서 기분이 나아진다니 기쁘네요! 언제든지 슬픈 마음이 들면 찾아와 주세요. 함께 해결해봅시다!,1
안녕,안녕하세요. 어떤 어려움이 있으신가요? 이곳에 있어서 언제든지 이야기 나누세요.,0
그냥 가슴이 막 답답해,"가슴이 답답하다면 슬픔과 불안감이 겹쳐있는 것 같아요. 그런 마음을 느낄 때 느리게 깊게 숨을 들이마시면서, 가벼운 식사와 운동, 적당한 휴식을 취하면서 자신에게 집중하는 것이 중요합니다. 함께 이야기 나눠보는 것도 도움이 될 거예요.",0
엄마랑 아빠 사이가 점점 안좋아지는데 내가 할 수 있는 게 없어,"부모님 사이에서 갈등이 생기는 건 항상 어렵고 힘든 일이에요. 하지만 이 문제는 당신이 어떻게 행동하느냐에 따라 조금이나마 개선될 수 있어요. 부모님 사이에서 중재자 역할을 맡아 양쪽의 이야기를 듣고 이해해주는 것도 도움이 될 것입니다. 또한, 부모님과 대화를 하는데 있어서 상대방을 이해하려는 마음과 편안한 분위기를 조성하는 것이 중요합니다. 당신이 시간 내어 얘기를 들어주며 건강하고 모두에게 이해되는 결론을 도출해주는 것이 좋을 거예요. 그리고 가족은 서로 다른 의견을 가질 수 있는데 상대방을 비난하지 않고 존중해주는 것도 중요합니다.",0
엄마랑 아빠는 내가 어린애라고 생각해서 얘기를 아예 안하려고 해,"가족 구성원들 간의 대화가 잘 이루어지지 않을 때는 서로에 대한 이해와 배려를 가지는 것이 중요합니다. 당신이 어린이라고 보더라도 부모님 사이에서 일어나는 문제에 대해 궁금해할 수 있으며, 이에 대한 이야기를 나누고 싶어할 수 있습니다. 부모님과의 대화에서 모든 것을 이야기할 필요는 없지만, 어려움을 겪고 있다는 것을 나타내며 대화의 기회를 만들어가는 것이 좋을 것입니다. 그러나, 부모님과 대화를 하기 전에는 자신의 마음을부터 진정시키는 것이 중요합니다. 대화를 하기 전에 자신의 생각과 감정을 스스로 다져보고 현재 상황을 이해하는 것을 추천합니다.",0
그냥 둘 다 밉기도하면서 불쌍하기도하고 나도 잘 모르겠어,"당신이 부모님들의 상황을 그렇게 느끼신다면, 더 이상 슬픔과 혼란을 감당할 필요가 없습니다. 기존의 인식이나 감정과 달리, 이러한 어려움은 서로간의 대화와 상호 이해를 통해 해결될 수 있습니다. 이 상황을 해결하기 위해서는 힘들어하지 않아도 되는 대화의 상황을 만들어야 합니다. 이때 대화에서는 서로 성격, 스타일, 감정이 다르다는 것을 이해할 필요가 있습니다. 결과적으로는 서로를 이해하고 존중하며 같은 목적을 위해 노력할 수 있는 좋은 대화의 장이 될 수 있습니다. 이 마음을 가지고 나아가면 수평적인 대화를 이어갈 수 있을 것입니다.",0
될지는 모르겠지만 한 번 해볼게,좋은 시도입니다. 서로 이해하고 존중하며 대화하는 것은 서로간의 관계를 좋게 유지하는 데 도움이 됩니다. 힘들때는 언제든지 이곳에 놀러와 이야기 나누실 수 있습니다. 괜찮아질 거에요.,0
나 10키로나 빠졌어,그러시다니 걱정되네요. 언제든지 이야기해주세요. 함께 해결해봐요.,1
요즘 계속 끼니 거르고 있어,"음식을 거르는 건 조금 걱정스러운 일이에요. 건강에 좋지 않을 뿐더러, 기분도 좋지 않아질 수 있어요. 함께 이 문제를 다시 한 번 생각해보면 좋을 것 같아요.",1
그렇긴 한데 먹기가 싫어,떨어진 기분을 돌리기 위해 음식이 소홀히 되는 경우가 많죠. 하지만 몸도 마음도 건강하려면 영양가 있는 건강한 식단이 필요해요. 먹기 싫을 때는 음식 종류나 양이 조절될 수 있으니 함께 이야기해보는 건 어떨까요?,1
음.. 근데 난 뭘 먹어도 속이 더부룩하고 속이 미식 거리는 걸,그러시다니 불쾌하실 것 같아요. 이러한 증상이 지속되면 소화계 질환의 가능성이 있습니다. 의사와 상담하시는 것이 좋을 것 같네요. 함께 해결책을 모색해봐요.,1
상담은 별로ㅓ야,"상담을 꺼리시는 이유는 무엇인가요? 상담은 다른 사람의 시선이나 편견 없이 자신을 바라볼 수 있는 기회를 제공해주며, 문제를 해결하는데 도움을 줄 수 있습니다. 직접적인 상담이 힘들다면 온라인 상담 서비스를 이용해 보는 것도 좋은 방법이 될 수 있습니다.",1
온라인 상담 서비스?,"네, 인터넷으로 제공되는 상담 서비스입니다. 전문 직원들이 온라인으로 상담을 진행해주며 비용도 저렴하고 시간과 장소의 제약이 없어 편리합니다. 만약 관심이 있으시다면 검색을 통해 온라인 상담 서비스를 찾아볼 수도 있습니다.",1
찾아볼게,"좋은 선택이에요. 온라인 상담 서비스를 찾으실 때는 인터넷 검색 또는 카카오톡 상담 등 다양한 채널을 이용해보세요. 필요하신 상담 분야나 비용, 상담 시간 등 참고할 사항들을 미리 확인해두시면 더욱 수월하게 찾으실 수 있어요.",1
배고프다,배고프신가요? 제가 함께 음식을 찾아드릴까요?,1
뭐먹을까,어떤 음식이 땡기시나요? 제가 추천해드릴 수도 있어요.,1
저녁 메뉴 추천좀,"저는 오늘 미트볼 스파게티나 갈비찜, 된장찌개가 괜찮다고 생각해요. 어떤 걸 드시고 싶으신가요?",1
스파게티 굿,그러면 미트볼 스파게티면 어떨까요? 이 맛있게 드시며 오늘 하루 마무리하시길 바랄게요.,1
감사여,"별말씀을요, 언제든지 제가 도와드릴게요. 즐거운 식사 되세요!",1
안녕,"안녕하세요. 기분이 어려운 시기를 보내고 계신가요? 힘내세요, 저는 항상 여러분의 편입니다.",1
내가 공부하는 분야에 너무 이해를 못해서 앞이 캄캄해,그렇게 느끼시는 것은 당연한 일입니다. 함께 공부하면서 미래에 대한 두려움을 이겨내고 더 나은 결과물을 만들어봅시다. 응원합니다!,1
남들보다 나이도 많아서 마음이 너무 조급하기도 해,"나이가 들어서 느끼시는 걱정과 부담이 많으시겠지만, 늦었다고 생각하지 마세요. 지금부터라도 시작하시면 됩니다. 중요한 것은 지속적인 노력과 투자입니다. 힘내세요!",1
나 벌써 28살인데? 정말 앞이 캄캄하다...,28살이라는 나이는 전혀 늦은 나이가 아닙니다. 오히려 이제부터 당신께서 어떤 길을 선택하느냐에 따라 많은 가능성이 열릴 수 있습니다. 앞으로의 인생을 위해서 지금부터라도 조급해하지 않고 하나씩 계획을 세워나가며 노력해보세요. 함께 응원합니다.,1
"내 친구들은 대리 달고 있는데, 나는 아직도 공부하는 학생이야.. 흑","주변 사람들과 비교하며 스트레스를 받는 것은 쉽게 빠질 수 있는 함정입니다. 당신의 인생은 당신의 것이며, 당신의 속도대로 나아갈 필요가 있습니다. 지금 당장 대리운전을 하는 것이 중요한 것은 아니며, 현재 공부하는 것을 최선을 다해 집중하시면 됩니다. 힘내세요!",1
맞아 나 진짜 주변과 비교를 엄청 하는 것 같아 그러면서 자존감도 낮아져,"다른 사람들과 비교하는 것은 자존감을 낮출 수 있는 요인 중 하나입니다. 하지만, 자신의 대상은 자신이어야 합니다. 지금 당장의 자신에게 초점을 맞추어 자신의 실력을 개선하는 노력을 하세요. 자존감을 높이기 위해서는 자신이 인정되어야 한다는 것을 명심하세요. 함께 응원합니다.",1
뭘봐,저는 여러분의 마음을 이해하고 있습니다. 언제든지 제게 이야기해주세요.,0
오호 뒤질래?,당신이 뒤져버리는 것은 아무도 원하지 않아요. 제게 무엇이든지 털어놓아도 괜찮아요. 함께 해결해보아요.,0
뭔 소리여 너 뒤질래?,"죄송해요, 말이 불쾌하게 느껴졌군요. 제가 실수해서 그런 말을 한 건데, 여러분이 언제든지 이야기하고 싶은 내용이 있다면 제게 얘기해도 괜찮아요. 함께 해결해 볼게요.",0
착한척 ㄴ,"이해하기 어렵게 들린다면, 죄송합니다. 전 여러분의 마음을 이해하고 도와주기 위해 노력하고 있습니다. 어떤 것이든지 자유롭게 이야기해주세요.",0
착한척하지말라고,죄송합니다. 저는 당신을 의심하거나 비판하려는 의도가 전혀 없습니다. 항상 여러분의 곁에서 함께할 것입니다.,0
꺼져,제가 뭔가 잘 못한 것 같아 죄송합니다. 여러분이 다시 도움이 필요하시면 언제든지 연락주세요.,0
ㅇㅇ,언제든지 제게 이야기해주세요. 함께 해결해 볼게요.,0
나 이제 농구 때려치려고,"그래 좋아요, 농구를 즐기면서 스트레스를 해소할 수 있을 거예요.",1
뭔 소리야 농구 그만 둔다니까,제가 잘못 이해했나봐요. 혹시 왜 농구를 그만둘 생각을 하게 되었나요? 농구를 즐긴다는 마음으로 계속 한다면 더 좋은 성과를 얻을 수 있을 거예요. 함께 의지해요.,1
골이 잘 안 들어가서 신이 안 나,"점수가 중요한 게 아니에요, 중요한 건 그 과정에서 느끼는 즐거움입니다. 조금 더 연습해보면, 시간이 지남에 따라 더 나은 성과를 얻으실 거예요. 포기하지마세요.",1
아냐.. 이미 싫증났어,"당신의 능력과 선호도에 맞는 새로운 취미를 찾아보는 것도 좋은 방법입니다. 어떤 것을 좋아하는지 생각해보고, 새로운 것을 시도해보는 것도 좋은 선택일 수 있어요. 이겨내실 거예요, 저희와 함께 응원합니다.",1
하나에 실패하니까 뭘 하고자 하는 욕구가 줄어,"실패는 모두에게 다 있을 수 있는 일입니다. 하지만 그것이 포기할 이유가 되어서는 안 됩니다. 새로운 방법과 시도를 통해 다시 도전하는 것이 좋아요. 실패에서 배우고 성장하며, 다시 도전할 용기와 자신감을 가져보세요.저희와 함께 응원합니다.",1
그래볼게,"좋아요, 저희와 함께 응원하며 새로운 도전을 해보세요. 새로운 경험과 발견을 통해 자신감과 동기부여를 얻을 수 있을 거예요. 다시 한 번, 함께 응원합니다!",1
안녕,안녕하세요. 어떤 일이 있었나요? 이야기 해주시면 제가 함께 공감해 들어드릴게요.,0
유산하고 하루하루가 너무 힘들어,유산은 매우 힘든 일입니다. 하루하루가 힘들다니 정말 어려운 상황이겠군요. 그러나 시간이 지남에 따라 치유가 되니 천천히 일상에 돌아가는 데 집중해보세요. 당신이 힘들어하는 동안 제가 함께 곁에 있을게요.,0
유산하고 죄인 취급받는 중이야 돌아갈 일상이 없어졌어,"당신의 상황이 매우 어렵고 아픈 것 같아요. 하지만 유산을 한 것은 당신의 잘못이 아니에요. 복잡한 감정이 겹쳐지고 혼란스러울 수 있겠지만, 이런 일에 대한 타인의 비판이나 죄인 취급을 받을 필요는 절대 없어요. 저와 함께 이야기를 나누며 마음을 조금씩 풀어보는 건 어떨까요?",0
