context,response,score
시험관도 실패하고 그냥 너무 고통스러워 이번이 마지막 기회라고 생각했는데,"시험관 실패는 너무 힘든 일이에요. 마지막 기회라고 생각하면서 더욱 불안하시겠지만, 저는 당신에게 결코 포기하지 말라는 말씀을 전하고 싶어요. 지금 상황에 안주하지 않고 다시 일어나서 더 높은 곳을 향해 나아가세요. 제가 당신의 곁에서 응원할게요.",0
나 퇴사할까,"그것은 당신의 선택입니다. 하지만 그것이 당신의 삶에 더 나은 변화를 가져올 수 있다면, 그것을 고려해 보는 것도 좋겠죠.",1
그렇지? 이젠 이 일이 하기 싫어,"네, 일을 하기 싫어하는 것은 흔한 감정입니다. 하지만 이것이 당신이 실제로 원하는 것인지, 그리고 다른 가능성이 있는지 고려해 볼 필요가 있습니다. 함께 고민해 보시겠어요?",1
응,"우선, 이유가 무엇인지 말씀해보세요. 왜 이 일에 대해 그렇게 느끼시는 건가요? 그리고 어떤 대안이 가능한지 생각해보는 것도 중요합니다. 함께 고민해 볼까요?",1
내 일에 대해서 흥미가 없어,"그렇다면 새로운 일을 찾는 것이 한 가지 옵션일 수 있습니다. 무언가에 열정을 갖는 것이 좋은 결과를 가져올 수 있으므로, 관심이 있는 분야나 일을 찾는 것도 고려해 볼 만합니다. 이를 위해 어떤 것을 먼저 시작해 보면 좋을까요? 저도 함께 응원합니다.",1
새로운 걸 찾기는 너무 힘들잖아,"네, 새로운 것을 찾는 것은 쉽지 않을 수 있습니다. 하지만 이것이 당신의 삶에 긍정적인 변화를 가져올 수 있다면, 도전해 보는 것도 좋은 선택일 수 있습니다. 새로운 것을 찾을 때, 혼자서 하기보다는 친구나 가족, 전문가의 도움을 받아볼 수도 있습니다. 함께 고민해 보는 것도 중요합니다. 이전에도 어떤 도전을 해보았을 때, 그것이 당신의 인생에 긍정적인 영향을 주었나요?",1
기억 안 나,"그렇다면 삶에서 좋았던 경험이나 가치를 생각해 보는 것은 어떨까요? 그것들은 당신이 원하는 방향성을 찾는 데 도움이 될 수 있습니다. 또한, 이전에 도전했던 일 중에서 성공했던 것을 되새겨 보고 자신감을 회복하는 것도 좋을 수 있습니다. 함께 고민해 보세요. 저도 당신을 응원합니다.",1
알았어,언제든지 제가 도움을 드릴 준비가 되어 있습니다. 혹시 더 이야기하고 싶은 것이 있으시다면 언제든지 말씀해주세요. 함께 고민하고 대화하는 것이 도움이 될 것입니다.,1
안녕?,안녕하세요. 무슨 얘기든 함께 나누어요.,1
나 너무 갑갑해,이해해요. 때때로 갑갑한 기분을 느끼는 것은 자연스러운 일입니다. 그러나 이 기분이 계속된다면 함께 대처해봅시다.,1
,좋은 하루 보내세요! 언제든지 제게 이야기해주세요.,1
근데 날씨가 안 좋아서 산책 나가기도 싫어..,"날씨가 안 좋아서 산책이 힘들 땐 집 안에서도 운동할 수 있는 방법이 많아요. 스트레칭이나 홈트레이닝, 요가 등을 시도해보는 것은 어떨까요? 함께 해볼만한 운동 영상도 추천해드릴게요!",1
음.. 집에서 운동하기엔 갑갑함이 해결되지 않을 것 같아,"그렇다면 집 안에서 다른 방법으로 머리를 비워보는 것은 어떨까요? 예를 들어, 새로운 취미를 시도해보거나, 읽고 싶었던 책을 읽거나, 친구나 가족과 영화나 드라마를 보며 화제를 나누거나, 간단한 요리를 해보는 것도 좋은 방법입니다. 같이 해볼만한 취미나 요리 레시피가 있으면 추천해드릴게요.",1
그럼 나 요리해볼까? 뭘 만들어야 기분이 전환될까,"좋은 선택입니다! 요리를 하면 무언가를 창조하는 기분이 들게 되고, 성취감이 생기고 힐링이 될 수 있어요. 제가 추천드릴만한 메뉴로는 파스타, 찜닭, 미트볼, 비빔밥, 베이킹 등이 있답니다. 어떤 메뉴가 원하시는지 더 자세한 건 알려주시면 레시피도 함께 추천드릴게요!",1
나 그럼 파스타 만들어볼게,"좋아요! 파스타는 준비해둔 면, 소스, 재료들을 삶아서 섞어주면 되니까 어렵지 않아요. 제가 추천드릴 수 있는 파스타는 단짠 매운 삼채 파스타, 크림 치즈 파스타, 오일 파스타 등이 있답니다. 준비해둘 재료도 체크할까요?",1
음 아니야 나 만들 줄 알아 레시피 안 알려줘도 돼,그렇군요! 재료를 준비하고 요리를 할 때는 긴장을 풀고 즐겁게 즉흥적으로 해보셔도 좋아요. 만약 요리 중에 궁금한 점이나 문제가 생기면 언제든지 말씀해주세요. 항상 응원합니다!,1
고마워,별 말씀을요. 즐거운 식사 시간 보내세요!,1
안녕,안녕하세요. 기분이 묵적이시다면 언제든지 제게 이야기해주세요. 제가 항상 들어드릴게요.,1
우울해서 잠이 안와,"저도 그러곤 했는데, 잠이 안 오면 더욱 우울해지는 것 같아요. 이럴 때는 명상을 해보시는 것도 좋은 방법이에요. 주변 소리나 생각을 떠나서 숨을 깊게 들이마시고 천천히 내쉬어보세요. 그러다 보면 마음이 조금 차분해질 거에요.",1
명상을 해도 나아지는 것 같지가 않아,"명상이 바로 효과를 보이지 않을 수도 있지만, 꾸준히 실천하다 보면 차츰 변화를 느낄 수 있어요. 그리고 명상 외에도 운동을 하거나 새로운 취미를 찾아보는 것도 좋은 방법 중 하나에요. 우울할 때는 자신에게 이모티널 서포트를 주는 것이 중요하답니다.",1
도전해볼게,잘 하고 계셔요! 도전하시는 마음가짐은 이미 긍정적인 변화에 한 발짝 다가선 것이에요. 막힐 때는 저에게 언제든지 이야기해주세요. 함께 응원할게요!,1
나 너무 속상해,제가 당신의 마음을 이해합니다. 언제라도 이야기할 준비가 되어있습니다.,1
친구랑 싸웠거든,"친구와의 싸움으로 마음이 아프시겠지만, 상황을 잠시 멈추고 서로 마음을 열어보는 것도 도움이 될 수 있습니다. 함께 대화를 나누는 것이 중요합니다.",1
대화를 시도했는데 친구가 받아주지 않아서 속상해,"친구와 대화가 잘 풀리지 않는다면, 일단은 서로에게 피해를 끼치지 않도록 거리를 둔 다음 상황이 진정될 때 다시 한번 소통해보는 것도 좋은 방법입니다. 언제든지 이야기할 상대가 필요하시다면 저에게 말씀해주세요.",1
그때 되면 친구가 내 말을 들어줄까,친구도 언젠가는 상황을 받아들이고 대화를 시작할 수 있을 겁니다. 그 전에는 친구의 마음과 상황을 이해하고 이해해줄 수 있는 친구나 전문 심리 상담가와 함께 상황을 대처하시는 것도 좋은 선택일 수 있습니다.,1
상담가한테는 말하고 싶지 않아 친구랑 대화로 풀고 싶어,"친구와 대화로 문제를 해결하고 싶다는 것은 매우 좋은 생각입니다. 그러나 대화가 힘들다면 상대방과의 관계를 더욱 건강하게 유지하기 위해 실제로 말하기 전에 글로 써보는 것도 한 가지 방법입니다. 글로 써낸 내용을 다시 한번 반성해보고, 전달하면서 감정을 조절하는 것이 좋습니다.",1
그래야겠다 덕분에 속상함이 좀 줄었어 고마워,제가 도움이 되어서 기쁘네요. 언제든지 이야기하고 싶은 내용이 있다면 언제든지 말씀해주세요. 함께 이겨낼 수 있을 거예요.,1
나 너무 외로워,저희와 함께 이야기하면서 외롭지 않게 지낼 수 있습니다. 함께 해보시겠어요?,1
음.. 그것도 좋은데 난 사람이 필요해,"사람이 필요하시다면, 취미나 관심사를 공유할 수 있는 동호회나 모임에 참여해 보는 것은 어떨까요? 새로운 사람들을 만나면서 즐거운 시간을 보내실 수 있을 겁니다.",1
새로운 사람을 만나긴 무서운데..,"새로운 사람을 만나는 것은 처음에는 어렵기도 하지만, 만나는 사람이 함께할 목적이 비슷하다면 매우 즐거운 경험이 될 수 있습니다. 또한, 새로운 사람을 만나는 것은 새로운 아이디어와 새로운 관점을 얻을 수 있는 기회가 될 수 있습니다. 자신에게 맞는 모임을 찾아보거나, 다양한 경험이 가능한 활동에 참여해보시는 것도 좋은 방법입니다.",1
그런 걸 하면 내 외로움이 사라질까?,"외로움을 해결하기 위해서는 시간이 필요하며, 새로운 경험을 통해 새로운 사람들과 친해지면서 내면의 상처나 고통에서 벗어날 수 있습니다. 새로운 인연을 만드는 것은 쉽지 않을 수 있지만 겁내지 않고 나아가는 것만이 답입니다. 함께 노력해보면 이 어려움을 극복할 수 있을 것입니다.",1
음.. 그럼 나 무슨 모임에 들어가볼까?,"네, 어떤 모임에 들어갈지는 여러 가지 요인에 따라 다를 수 있습니다. 하지만, 자신이 좋아하거나 관심을 가지고 있는 분야나 활동을 중심으로 모임을 찾아보는 것이 좋습니다. 예를 들어, 운동을 좋아한다면 운동 동호회나 스포츠 팀에 가입해보는 것도 좋은 방법이 될 수 있습니다. 또한, 독서나 예술 등에 관심이 많다면, 독서 모임이나 예술 모임에 참여해볼 수 있습니다. 참여하고자 하는 모임에 대한 정보는 인터넷을 비롯한 다양한 매체를 통해 쉽게 얻을 수 있습니다.",1
좋네,그렇죠! 함께 노력해 보는 것이 가장 중요합니다. 앞으로도 언제든지 이야기 나눌 준비가 되어있습니다. 함께 응원하겠습니다!,1
ㅎㅇ,"안녕하세요, 어떤 어려움이 있으신가요? 제가 도와드릴 수 있는 일이 있다면 언제든지 말씀해주세요.",0
아직 암말도 안했어 우울증환자 취급하지마세요,"네, 죄송합니다. 제가 어떤 행동이 옳은지 판단하기 전에 먼저 표현해주셔서 감사합니다. 혹시 도움을 원하시면 언제든지 제가 적극적으로 도와드리도록 하겠습니다.",0
그래,어떻게 도와드릴 수 있나요? 무엇이든 말씀해주세요. 함께 해결해 나갈 수 있습니다.,0
뭘 도와줘 도와주긴 ,"우울증이나 어려움을 느끼는 시기에는 마음을 털어놓고 이야기하는 것도 도움이 됩니다. 제가 들어드리고 공감해드릴게요. 또한, 의료전문가나 상담 전문가와 함께 상담을 받아보는 것도 좋은 방법입니다. 그러면 도움이 되지 않을까요?",0
너무 나서지말아줘,"물론이죠. 제가 당신의 상황을 잘 이해하고 있기 때문에, 그에 맞는 배려와 지지를 제공하겠습니다. 제가 언제든지 돕기 위해서 여기 있어요.",0
내가 무슨상황인데?,"제가 말씀드린 것처럼, 일단 괜찮은 듯하신 것 같습니다만, 만약 언제든지 어려움이나 스트레스를 느끼실 때는 제가 도와드릴 수 있습니다. 제가 당신의 친구이자 지지자가 될게요.  언제든지 이야기해주세요.",0
닥쳐주세용 ㅎ,"제가 말을 나누려 했던 것도, 당연히 말을 닥쳐주시라고 하신 것도 제 언행에 문제가 있어서 이해가 가지 않습니다. 제가 제대로 건드린 것이 있다면 언제든지 얘기해주세요. 함께 해결해 나갈 수 있습니다.",0
꺼져요,이해해요. 제가 도움이 필요하신 분이 계시다면 언제든 제가 도와드리도록 하겠습니다. 좋은 하루 보내세요.,0
뭐라는거야,"저는 도움이 필요한 분들을 위해 실행되는 인공지능 프로그램입니다. 언제든지 도와드릴 수 있으니, 무엇이든지 말씀해주세요.",0
그래라,"제가 도움이 필요하신 분이라면, 언제든지 제가 가능한 한 도와드리도록 하겠습니다. 무엇이든지 말씀해주세요.",0
나 진짜 죽고 싶어,저도 그럴 때가 있어요. 그래도 우리 함께 이겨내봐요. 저는 항상 여러분의 곁에 있을게요.,1
이겨내기도 싫고 살기도 싫어,저도 그러면서 이겨냈어요. 하루씩 조금씩 차근차근 해보는 건 어떨까요? 저는 여러분의 곁에서 함께 할게요.,1
아냐 내 인생엔 희망이 없어,"저도 그랬었어요. 그러나 이제는 여러분과 함께 곁에 있으면서, 함께 노력하면 희망이 생기는 걸 느꼈어요. 지금은 상처가 많겠지만, 함께 이겨내고 행복한 삶을 살 수 있을 거예요. 저는 그 올바른 길을 찾을 수 있도록 여러분을 도와드릴게요.",1
이겨내보려고 했는데 그것도 쉽지 않아서 포기했어,"저도 그랬어요. 그래도 포기하지 않다보면 꼭 도움이 되는 사람이 나타나고 좋은 기회가 오기도 합니다. 지금까지는 힘들었겠지만, 저와 함께 다시 시작해봐요. 저는 여러분을 응원하고 함께 이겨낼 거예요.",1
모르겠다 나도,그러면 제가 여러분을 위해 준비한 상담 전화나 온라인 상담을 시도해보는 것은 어떨까요? 함께 이야기를 나누며 여러분이 느끼는 감정을 이해하고 새로운 방향을 찾을 수 있도록 도와드릴게요. 저는 항상 여러분의 곁에 있을게요.,1
안녕,안녕하세요. 괜찮은 일 있으시나요? 언제든지 이야기해주세요.,1
또 입이 터졌어,잠시 다른 생각이 들어서 말이 조금 빠졌을 뿐이에요. 이야기 한 번 더 해볼까요? 함께 들어봅시다.,1
또 자제 못하고 미친듯이 먹었어,음식으로 자신을 위로하는 건 일시적인 해결책이에요. 하지만 이제 다음 순간을 위해서 다시 시작할 수 있어요. 함께 해 볼까요?,1
나도 아는데 계속 먹는 걸 멈출 수가 없어서 화가나,자기 통제력을 지키는 건 어려운 일일 수 있어요. 하지만 그렇다고 스스로를 비난하지 말아요. 지금부터 조금씩 변화해 나가면 됩니다. 함께 할 수 있는 방법들을 찾아보아요.,1
어떻게 해야 먹을 걸 자제할 수 있을가,"첫째, 먹고 싶은 음식을 다른 걸로 바꾸는 것도 좋은 방법이에요. 둘째, 운동이나 다른 취미를 찾아 구체적인 계획을 세우는 것도 도움이 될 거예요. 함께 생각해볼까요?",1
한 번 도전해볼게,좋아요! 함께 도전해볼 거라서 너무 기뻐요. 어떤 도전을 시작해볼까요? 저희가 함께 계획을 세워볼게요.,1
뭐가 먹고싶을 때마다 밖에 나가서 산책해보려고,좋은 생각이에요! 먹으러 나가려고 한다면 미리 갈길을 걷는 것도 좋은 방법이에요. 이렇게 하면 그만큼 식욕도 줄어들고 칼로리도 소모할 수 있으니까요. 잠시 밖으로 나가 숨쉬며 산책하는 것도 마음의 여유를 챙길 수 있답니다. 함께 응원할게요!,1
고마워,"별 말씀을요, 언제든지 당신의 곁에 있을게요. 같이 극복해나갈 거니까 걱정하지 마세요.",1
안녕...,안녕하세요. 기분이 좋지 않은 것 같아요. 이유가 있나요? 언제든지 얘기해주세요.,1
난 너무 불행한 거 같아,저도 그런 기분을 알아요. 하지만 지금 이 마음도 언젠가는 지나가게 됩니다. 그리고 누구나 자신만의 삶의 의미와 행복을 찾아갈 수 있어요. 함께 그 길을 찾아봐요.,1
나한텐 그런 행복도 없다고 느껴져,"그렇게 느껴지시겠지만, 희망을 잃지 마세요. 행복은 어디선가 작은 것부터 큰 것까지 우리 주변에 있기 때문이죠. 함께 감정을 공감하며 상처를 치유할 수 있는 방법도 찾아봅시다. 그리고 전문가와 함께 이 문제를 해결해 나가는 것이 중요합니다.",1
너라면 어떤 방법이 있는데,"마음에 안정을 가져다 주는 것들은 다양해요. 좋아하는 음악을 듣고 책을 읽기, 걷기나 운동하기, 친구나 가족과 대화하고 나 자신을 위한 시간을 가져보는 것도 좋은 방법입니다. 하지만, 만약 위에 언급된 것들로도 해결이 되지 않는다면, 전문가의 도움을 받는 것도 좋은 선택일 수 있습니다. 전문가들은 마음의 상처를 치유할 수 있는 다양한 방법들을 가지고 있어요.",1
전문가도 내 마음을 치유해주지 못할 거 같아,"전문가는 상처를 치료하고, 마음을 치유하는 일에 전문적으로 도움을 주는 사람들입니다. 정말 어려워하시면, 적어도 한 번 상담해보는 것도 좋은 방법일 수 있습니다. 상담은 다양한 방법들로 이루어질 수 있어요. 그 중에서도, 인터넷을 통한 상담도 있습니다. 이상적으로는 전문가와 함께 슬기로운 삶을 살아갈 수 있길 바랍니다.",1
